,Website,Journal,Volume,Issue,Title,Download Link
0,AMS,clim,Volume 33,Issue 16,An Interdecadal Change of the Boreal Summer Silk Road Pattern around the Late 1990s,https://journals.ametsoc.org/downloadpdf/view/journals/clim/33/16/JCLI-D-19-0795.1.pdf
0,AMS,clim,Volume 33,Issue 16,Combined Influences on North American Winter Air Temperature Variability from North Pacific Blocking and the North Atlantic Oscillation: Subseasonal and Interannual Time Scales,https://journals.ametsoc.org/downloadpdf/view/journals/clim/33/16/JCLI-D-19-0327.1.pdf
0,AMS,clim,Volume 33,Issue 16,Response of Vertical Velocities in Extratropical Precipitation Extremes to Climate Change,https://journals.ametsoc.org/downloadpdf/view/journals/clim/33/16/jcliD190766.pdf
0,AMS,clim,Volume 33,Issue 16,Tropical Pacific Surface Wind Energy Spectra and Coherence: Basinwide Observations and Their Observing System Implications,https://journals.ametsoc.org/downloadpdf/view/journals/clim/33/16/jcliD190836.pdf
0,AMS,clim,Volume 33,Issue 16,Linkage between Projected Precipitation and Atmospheric Thermodynamic Changes,https://journals.ametsoc.org/downloadpdf/view/journals/clim/33/16/jcliD190785.pdf
0,AMS,clim,Volume 33,Issue 16,Mechanisms of Winter Precipitation Variability in the European–Mediterranean Region Associated with the North Atlantic Oscillation,https://journals.ametsoc.org/downloadpdf/view/journals/clim/33/16/jcliD200011.pdf
0,AMS,clim,Volume 33,Issue 16,Impacts of Oceanic and Atmospheric Heat Transports on Sea Ice Extent,https://journals.ametsoc.org/downloadpdf/view/journals/clim/33/16/jcliD190761.pdf
0,AMS,clim,Volume 33,Issue 16,The Extratropical Linear Step Response to Tropical Precipitation Anomalies and Its Use in Constraining Projected Circulation Changes under Climate Warming,https://journals.ametsoc.org/downloadpdf/view/journals/clim/33/16/jcliD200060.pdf
0,AMS,clim,Volume 33,Issue 17,Vertical Structure of the Upper–Indian Ocean Thermal Variability,https://journals.ametsoc.org/downloadpdf/view/journals/clim/33/17/jcliD190851.pdf
0,AMS,clim,Volume 33,Issue 17,Why Does a Colder (Warmer) Winter Tend to Be Followed by a Warmer (Cooler) Summer over Northeast Eurasia?,https://journals.ametsoc.org/downloadpdf/view/journals/clim/33/17/jcliD200036.pdf
0,AMS,clim,Volume 33,Issue 17,Projected Changes in South Asian Monsoon Low Pressure Systems,https://journals.ametsoc.org/downloadpdf/view/journals/clim/33/17/jcliD200168.pdf
0,AMS,clim,Volume 33,Issue 17,Tropical Pacific Decadal Variability Induced by Nonlinear Rectification of El Niño–Southern Oscillation,https://journals.ametsoc.org/downloadpdf/view/journals/clim/33/17/jcliD190123.pdf
0,AMS,clim,Volume 33,Issue 17,Greater Future U.K. Winter Precipitation Increase in New Convection-Permitting Scenarios,https://journals.ametsoc.org/downloadpdf/view/journals/clim/33/17/jcliD200089.pdf
0,AMS,clim,Volume 33,Issue 17,Impact of Coherent Ocean Stratification on AMOC Reconstruction by Coupled Data Assimilation with a Biased Model,https://journals.ametsoc.org/downloadpdf/view/journals/clim/33/17/jcliD190735.pdf
0,AMS,clim,Volume 33,Issue 17,The North Atlantic as a Driver of Summer Atmospheric Circulation,https://journals.ametsoc.org/downloadpdf/view/journals/clim/33/17/jcliD190423.pdf
0,AMS,clim,Volume 33,Issue 17,The Value of Initialization on Decadal Timescales: State-Dependent Predictability in the CESM Decadal Prediction Large Ensemble,https://journals.ametsoc.org/downloadpdf/view/journals/clim/33/17/jcliD190571.pdf
0,AMS,clim,Volume 33,Issue 17,"Characteristics of the Onset, Withdrawal, and Breaks of the Western North Pacific Summer Monsoon in the 1949–2014 Period",https://journals.ametsoc.org/downloadpdf/view/journals/clim/33/17/jcliD190734.pdf
0,AMS,clim,Volume 33,Issue 17,Testing the Trade Wind Charging Mechanism and Its Influence on ENSO Variability,https://journals.ametsoc.org/downloadpdf/view/journals/clim/33/17/jcliD190727.pdf
0,AMS,clim,Volume 33,Issue 17,Combining Emergent Constraints for Climate Sensitivity,https://journals.ametsoc.org/downloadpdf/view/journals/clim/33/17/jcliD190911.pdf
0,AMS,clim,Volume 33,Issue 17,An Internal Atmospheric Process Determining Summertime Arctic Sea Ice Melting in the Next Three Decades: Lessons Learned from Five Large Ensembles and Multiple CMIP5 Climate Simulations,https://journals.ametsoc.org/downloadpdf/view/journals/clim/33/17/jcliD190803.pdf
0,AMS,clim,Volume 33,Issue 17,The Meridional Shift of the Midlatitude Westerlies over Arid Central Asia during the Past 21 000 Years Based on the TraCE-21ka Simulations,https://journals.ametsoc.org/downloadpdf/view/journals/clim/33/17/jcliD190798.pdf
0,AMS,clim,Volume 33,Issue 17,Analyzing the Arctic Feedback Mechanism between Sea Ice and Low-Level Clouds Using 34 Years of Satellite Observations,https://journals.ametsoc.org/downloadpdf/view/journals/clim/33/17/jcliD190895.pdf
0,AMS,clim,Volume 33,Issue 17,Global Pattern Formation of Net Ocean Surface Heat Flux Response to Greenhouse Warming,https://journals.ametsoc.org/downloadpdf/view/journals/clim/33/17/jcliD190642.pdf
0,AMS,clim,Volume 33,Issue 17,North Pacific Upper-Ocean Cold Temperature Biases in CMIP6 Simulations and the Role of Regional Vertical Mixing,https://journals.ametsoc.org/downloadpdf/view/journals/clim/33/17/jcliD190654.pdf
0,AMS,clim,Volume 33,Issue 17,The Tropical Pacific ENSO–Mean State Relationship in Climate Models over the Last Millennium,https://journals.ametsoc.org/downloadpdf/view/journals/clim/33/17/jcliD190673.pdf
0,AMS,clim,Volume 33,Issue 17,Remote Tropical Western Indian Ocean Forcing on Changes in June Precipitation in South China and the Indochina Peninsula,https://journals.ametsoc.org/downloadpdf/view/journals/clim/33/17/jcliD190626.pdf
0,AMS,clim,Volume 33,Issue 17,The Influence of Atlantic Variability on Asian Summer Climate Is Sensitive to the Pattern of the Sea Surface Temperature Anomaly,https://journals.ametsoc.org/downloadpdf/view/journals/clim/33/17/jcliD200039.pdf
0,AMS,clim,Volume 33,Issue 17,Representation of Modes of Variability in Six U.S. Climate Models,https://journals.ametsoc.org/downloadpdf/view/journals/clim/33/17/jcliD190956.pdf
0,AMS,clim,Volume 33,Issue 17,The Key Role of Coupled Chemistry–Climate Interactions in Tropical Stratospheric Temperature Variability,https://journals.ametsoc.org/downloadpdf/view/journals/clim/33/17/jcliD200071.pdf
0,AMS,clim,Volume 33,Issue 17,Heavy Daily Precipitation Events in the CMIP6 Worst-Case Scenario: Projected Twenty-First-Century Changes,https://journals.ametsoc.org/downloadpdf/view/journals/clim/33/17/jcliD190940.pdf
0,AMS,clim,Volume 33,Issue 17,Quasi-Biweekly Oscillation of the Bay of Bengal–East Asia–Pacific Teleconnection in Boreal Summer,https://journals.ametsoc.org/downloadpdf/view/journals/clim/33/17/jcliD190856.pdf
0,AMS,clim,Volume 33,Issue 17,Budgets for Decadal Variability in Pacific Ocean Heat Content,https://journals.ametsoc.org/downloadpdf/view/journals/clim/33/17/jcliD190360.pdf
0,AMS,clim,Volume 33,Issue 17,Memory Effect of the Southern Atlantic Subtropical Dipole,https://journals.ametsoc.org/downloadpdf/view/journals/clim/33/17/jcliD190745.pdf
0,AMS,clim,Volume 33,Issue 17,Decadal to Multidecadal Variability of the Mixed Layer to the South of the Kuroshio Extension Region,https://journals.ametsoc.org/downloadpdf/view/journals/clim/33/17/jcliD200115.pdf
0,AMS,clim,Volume 33,Issue 18,Observed Sensitivity of Low-Cloud Radiative Effects to Meteorological Perturbations over the Global Oceans,https://journals.ametsoc.org/downloadpdf/view/journals/clim/33/18/jcliD191028.pdf
0,AMS,clim,Volume 33,Issue 18,Systematic Differences in Bucket Sea Surface Temperatures Caused by Misclassification of Engine Room Intake Measurements,https://journals.ametsoc.org/downloadpdf/view/journals/clim/33/18/jcliD190972.pdf
0,AMS,clim,Volume 33,Issue 18,Intermodel Spread in the Pattern Effect and Its Contribution to Climate Sensitivity in CMIP5 and CMIP6 Models,https://journals.ametsoc.org/downloadpdf/view/journals/clim/33/18/jcliD191011.pdf
0,AMS,clim,Volume 33,Issue 18,A Simple Trajectory Model for Climatological Study of Tropical Cyclones,https://journals.ametsoc.org/downloadpdf/view/journals/clim/33/18/jcliD200285.pdf
0,AMS,clim,Volume 33,Issue 18,Convection-Permitting Regional Climate Simulations in the Arabian Gulf Region Using WRF Driven by Bias-Corrected GCM Data,https://journals.ametsoc.org/downloadpdf/view/journals/clim/33/18/jcliD200155.pdf
0,AMS,clim,Volume 33,Issue 18,Statistical Relationship between Atmospheric Rivers and Extratropical Cyclones and Anticyclones,https://journals.ametsoc.org/downloadpdf/view/journals/clim/33/18/jcliD190126.pdf
0,AMS,clim,Volume 33,Issue 18,Isolating the Evolving Contributions of Anthropogenic Aerosols and Greenhouse Gases: A New CESM1 Large Ensemble Community Resource,https://journals.ametsoc.org/downloadpdf/view/journals/clim/33/18/jcliD200123.pdf
0,AMS,clim,Volume 33,Issue 18,Projected End-of-Century Changes in the South American Monsoon in the CESM Large Ensemble,https://journals.ametsoc.org/downloadpdf/view/journals/clim/33/18/jcliD190645.pdf
0,AMS,clim,Volume 33,Issue 18,The Long-Term Trend of Upper-Air Temperature in China Derived from Microwave Sounding Data and Its Comparison with Radiosonde Observations,https://journals.ametsoc.org/downloadpdf/view/journals/clim/33/18/jcliD190742.pdf
0,AMS,clim,Volume 33,Issue 18,Seasonal Dependency of Tropical Precipitation Change under Global Warming,https://journals.ametsoc.org/downloadpdf/view/journals/clim/33/18/jcliD200032.pdf
0,AMS,clim,Volume 33,Issue 18,Optimal Estimation of Stochastic Energy Balance Model Parameters,https://journals.ametsoc.org/downloadpdf/view/journals/clim/33/18/jcliD190589.pdf
0,AMS,clim,Volume 33,Issue 18,"The Role of Tropical, Midlatitude, and Polar Cloud-Radiative Changes for the Midlatitude Circulation Response to Global Warming",https://journals.ametsoc.org/downloadpdf/view/journals/clim/33/18/jcliD200073.pdf
0,AMS,clim,Volume 33,Issue 18,Origins of East Asian Summer Monsoon Seasonality,https://journals.ametsoc.org/downloadpdf/view/journals/clim/33/18/jcliD190888.pdf
0,AMS,clim,Volume 33,Issue 18,Contributions of Different Combinations of the IPO and AMO to the Concurrent Variations of Summer East Asian Jets,https://journals.ametsoc.org/downloadpdf/view/journals/clim/33/18/jcliD190366.pdf
0,AMS,clim,Volume 33,Issue 18,Differences in Western North Pacific Tropical Cyclone Activity among Three El Niño Phases,https://journals.ametsoc.org/downloadpdf/view/journals/clim/33/18/jcliD200162.pdf
0,AMS,clim,Volume 33,Issue 18,Are the Transient and Equilibrium Climate Change Patterns Similar in Response to Increased CO2?,https://journals.ametsoc.org/downloadpdf/view/journals/clim/33/18/jcliD190749.pdf
0,AMS,clim,Volume 33,Issue 18,Surging of Global Surface Temperature due to Decadal Legacy of Ocean Heat Uptake,https://journals.ametsoc.org/downloadpdf/view/journals/clim/33/18/jcliD190874.pdf
0,AMS,clim,Volume 33,Issue 18,The Arctic Surface Climate in CMIP6: Status and Developments since CMIP5,https://journals.ametsoc.org/downloadpdf/view/journals/clim/33/18/jcliD190990.pdf
0,AMS,clim,Volume 33,Issue 18,Severe Cold Winter in North America Linked to Bering Sea Ice Loss,https://journals.ametsoc.org/downloadpdf/view/journals/clim/33/18/jcliD190994.pdf
0,AMS,clim,Volume 33,Issue 18,"The Impact of Anthropogenic Forcing and Natural Processes on Past, Present, and Future Rainfall over Victoria, Australia",https://journals.ametsoc.org/downloadpdf/view/journals/clim/33/18/jcliD190759.pdf
0,AMS,clim,Volume 33,Issue 18,Weakening of Cold Halocline Layer Exposes Sea Ice to Oceanic Heat in the Eastern Arctic Ocean,https://journals.ametsoc.org/downloadpdf/view/journals/clim/33/18/jcliD190976.pdf
0,AMS,clim,Volume 33,Issue 18,Modulations of North American and European Weather Variability and Extremes by Interdecadal Variability of the Atmospheric Circulation over the North Atlantic Sector,https://journals.ametsoc.org/downloadpdf/view/journals/clim/33/18/jcliD190977.pdf
0,AMS,clim,Volume 33,Issue 18,Response of the Asian Summer Monsoon Precipitation to Global Warming in a High-Resolution Global Nonhydrostatic Model,https://journals.ametsoc.org/downloadpdf/view/journals/clim/33/18/jcliD190824.pdf
0,AMS,clim,Volume 33,Issue 19,Observed Temperature Changes in the Troposphere and Stratosphere from 1979 to 2018,https://journals.ametsoc.org/downloadpdf/view/journals/clim/33/19/jcliD190998.pdf
0,AMS,clim,Volume 33,Issue 19,How Do Volcanic Eruptions Influence Decadal Megadroughts over Eastern China?,https://journals.ametsoc.org/downloadpdf/view/journals/clim/33/19/jcliD190394.pdf
0,AMS,clim,Volume 33,Issue 19,Biases in CMIP5 Sea Surface Temperature and the Annual Cycle of East African Rainfall,https://journals.ametsoc.org/downloadpdf/view/journals/clim/33/19/jcliD200092.pdf
0,AMS,clim,Volume 33,Issue 19,Improved Detection of Interannual Cloud Variability over the Southern Hemisphere Using Legacy Satellites,https://journals.ametsoc.org/downloadpdf/view/journals/clim/33/19/jcliD190758.pdf
0,AMS,clim,Volume 33,Issue 19,Warming Patterns Affect El Niño Diversity in CMIP5 and CMIP6 Models,https://journals.ametsoc.org/downloadpdf/view/journals/clim/33/19/jcliD190890.pdf
0,AMS,clim,Volume 33,Issue 19,"The Diurnal Temperature Range in CMIP6 Models: Climatology, Variability, and Evolution",https://journals.ametsoc.org/downloadpdf/view/journals/clim/33/19/jcliD190897.pdf
0,AMS,clim,Volume 33,Issue 19,Strengthened Linkage between November/December North Atlantic Oscillation and Subsequent January European Precipitation after the Late 1980s,https://journals.ametsoc.org/downloadpdf/view/journals/clim/33/19/jcliD190662.pdf
0,AMS,clim,Volume 33,Issue 19,The Contribution of Boreal Spring South Pacific Atmospheric Variability to El Niño Occurrence,https://journals.ametsoc.org/downloadpdf/view/journals/clim/33/19/jcliD200122.pdf
0,AMS,clim,Volume 33,Issue 19,"The Effect of Explicit Convection on Couplings between Rainfall, Humidity, and Ascent over Africa under Climate Change",https://journals.ametsoc.org/downloadpdf/view/journals/clim/33/19/jcliD190322.pdf
0,AMS,clim,Volume 33,Issue 19,Climatology of Severe Local Storm Environments and Synoptic-Scale Features over North America in ERA5 Reanalysis and CAM6 Simulation,https://journals.ametsoc.org/downloadpdf/view/journals/clim/33/19/jcliD190986.pdf
0,AMS,clim,Volume 33,Issue 19,An Assessment of MJO Circulation Influence on Air–Sea Interactions for Improved Seasonal Rainfall Predictions over East Africa,https://journals.ametsoc.org/downloadpdf/view/journals/clim/33/19/jcliD190296.pdf
0,AMS,clim,Volume 33,Issue 19,Sensitivities and Responses of Land Surface Temperature to Deforestation-Induced Biophysical Changes in Two Global Earth System Models,https://journals.ametsoc.org/downloadpdf/view/journals/clim/33/19/jcliD190725.pdf
0,AMS,clim,Volume 33,Issue 19,On the Oceanic Origin for the Enhanced Seasonal Cycle of SST in the Midlatitudes under Global Warming,https://journals.ametsoc.org/downloadpdf/view/journals/clim/33/19/jcliD200114.pdf
0,AMS,clim,Volume 33,Issue 19,Uncertainties in Ocean Latent Heat Flux Variations over Recent Decades in Satellite-Based Estimates and Reduced Observation Reanalyses,https://journals.ametsoc.org/downloadpdf/view/journals/clim/33/19/jcliD190954.pdf
0,AMS,clim,Volume 33,Issue 19,Dramatic Weakening of the Tropical Easterly Jet Projected by CMIP6 Models,https://journals.ametsoc.org/downloadpdf/view/journals/clim/33/19/jcliD191002.pdf
0,AMS,clim,Volume 33,Issue 19,The Moisture Budget of Tropical Cyclones in HighResMIP Models: Large-Scale Environmental Balance and Sensitivity to Horizontal Resolution,https://journals.ametsoc.org/downloadpdf/view/journals/clim/33/19/jcliD190999.pdf
0,AMS,clim,Volume 33,Issue 19,Decline in Temperature Variability on Svalbard,https://journals.ametsoc.org/downloadpdf/view/journals/clim/33/19/jcliD200174.pdf
0,AMS,clim,Volume 33,Issue 19,Breakdown of the Summertime Meridional Teleconnection Pattern over the Western North Pacific and East Asia since the Early 2000s,https://journals.ametsoc.org/downloadpdf/view/journals/clim/33/19/jcliD190746.pdf
0,AMS,clim,Volume 33,Issue 19,Why Has the Inner Tibetan Plateau Become Wetter since the Mid-1990s?,https://journals.ametsoc.org/downloadpdf/view/journals/clim/33/19/jcliD190471.pdf
0,AMS,clim,Volume 33,Issue 19,Reexamining the MJO Moisture Mode Theories with Normalized Phase Evolutions,https://journals.ametsoc.org/downloadpdf/view/journals/clim/33/19/jcliD200202.pdf
0,AMS,clim,Volume 33,Issue 19,Changes in Normalized Difference Vegetation Index in the Orinoco and Amazon River Basins: Links to Tropical Atlantic Surface Temperatures,https://journals.ametsoc.org/downloadpdf/view/journals/clim/33/19/jcliD190696.pdf
0,AMS,clim,Volume 33,Issue 19,Plant Physiology Increases the Magnitude and Spread of the Transient Climate Response to CO2 in CMIP6 Earth System Models,https://journals.ametsoc.org/downloadpdf/view/journals/clim/33/19/jcliD200078.pdf
0,AMS,clim,Volume 33,Issue 19,Coupled Climate Model Simulation of Tropical–Extratropical Cloud Bands over Southern Africa,https://journals.ametsoc.org/downloadpdf/view/journals/clim/33/19/jcliD190731.pdf
0,AMS,clim,Volume 33,Issue 19,Trends and Variability in Airmass Frequencies: Indicators of a Changing Climate,https://journals.ametsoc.org/downloadpdf/view/journals/clim/33/19/jcliD200094.pdf
0,AMS,clim,Volume 33,Issue 20,Observational Evidence that Radiative Heating Modifies the Life Cycle of Tropical Anvil Clouds,https://journals.ametsoc.org/downloadpdf/view/journals/clim/33/20/jcliD200204.pdf
0,AMS,clim,Volume 33,Issue 20,Interannual Variability of the Basinwide Translation Speed of Tropical Cyclones in the Western North Pacific,https://journals.ametsoc.org/downloadpdf/view/journals/clim/33/20/jcliD190995.pdf
0,AMS,clim,Volume 33,Issue 20,The Boreal Winter El Niño Precipitation Response over North America: Insights into Why January Is More Difficult to Predict Than February,https://journals.ametsoc.org/downloadpdf/view/journals/clim/33/20/jcliD190841.pdf
0,AMS,clim,Volume 33,Issue 20,Comparing Methods to Constrain Future European Climate Projections Using a Consistent Framework,https://journals.ametsoc.org/downloadpdf/view/journals/clim/33/20/jcliD190953.pdf
0,AMS,clim,Volume 33,Issue 20,Pattern Recognition Methods to Separate Forced Responses from Internal Variability in Climate Model Ensembles and Observations,https://journals.ametsoc.org/downloadpdf/view/journals/clim/33/20/jcliD190855.pdf
0,AMS,clim,Volume 33,Issue 20,Australian Precipitation Recycling and Evaporative Source Regions,https://journals.ametsoc.org/downloadpdf/view/journals/clim/33/20/jcliD190926.pdf
0,AMS,clim,Volume 33,Issue 20,Precipitation–Radiation–Circulation Feedback Processes Associated with Structural Changes of the ITCZ in a Warming Climate during 1980–2014: An Observational Portrayal,https://journals.ametsoc.org/downloadpdf/view/journals/clim/33/20/jcliD200068.pdf
0,AMS,clim,Volume 33,Issue 20,Global Patterns of Spatial and Temporal Variability in Salinity from Multiple Gridded Argo Products,https://journals.ametsoc.org/downloadpdf/view/journals/clim/33/20/jcliD200053.pdf
0,AMS,clim,Volume 33,Issue 20,"Local Rossby Wave Packet Amplitude, Phase Speed, and Group Velocity: Seasonal Variability and Their Role in Temperature Extremes",https://journals.ametsoc.org/downloadpdf/view/journals/clim/33/20/jcliD190377.pdf
0,AMS,clim,Volume 33,Issue 20,Radiative Effects of Clouds and Water Vapor on an Axisymmetric Monsoon,https://journals.ametsoc.org/downloadpdf/view/journals/clim/33/20/jcliD190974.pdf
0,AMS,clim,Volume 33,Issue 20,Analysis of Record-High Temperature over Southeast Coastal China in Winter 2018/19: The Combined Effect of Mid- to High-Latitude Circulation Systems and SST Forcing over the North Atlantic and Tropical Western Pacific,https://journals.ametsoc.org/downloadpdf/view/journals/clim/33/20/jcliD190732.pdf
0,AMS,clim,Volume 33,Issue 20,Is the North Pacific Victoria Mode a Predictor of Winter Rainfall over South China?,https://journals.ametsoc.org/downloadpdf/view/journals/clim/33/20/jcliD190789.pdf
0,AMS,clim,Volume 33,Issue 20,Arctic Ocean and Hudson Bay Freshwater Exports: New Estimates from Seven Decades of Hydrographic Surveys on the Labrador Shelf,https://journals.ametsoc.org/downloadpdf/view/journals/clim/33/20/jcliD190083.pdf
0,AMS,clim,Volume 33,Issue 20,Impacts of Stratospheric Ozone Extremes on Arctic High Cloud,https://journals.ametsoc.org/downloadpdf/view/journals/clim/33/20/jcliD190867.pdf
0,AMS,clim,Volume 33,Issue 20,Correction of Inhomogeneities in Observed Land Surface Temperatures over China,https://journals.ametsoc.org/downloadpdf/view/journals/clim/33/20/jcliD190521.pdf
0,AMS,clim,Volume 33,Issue 20,Impacts of MJO on the Intraseasonal Temperature Variation in East Asia,https://journals.ametsoc.org/downloadpdf/view/journals/clim/33/20/jcliD200302.pdf
0,AMS,clim,Volume 33,Issue 20,Climate Response to Increasing Antarctic Iceberg and Ice Shelf Melt,https://journals.ametsoc.org/downloadpdf/view/journals/clim/33/20/jcliD190881.pdf
0,AMS,clim,Volume 33,Issue 20,Interactions between Increasing CO2 and Antarctic Melt Rates,https://journals.ametsoc.org/downloadpdf/view/journals/clim/33/20/jcliD190882.pdf
0,AMS,clim,Volume 33,Issue 20,Characterizing the Seasonal Cycle of the Northern Australian Rainy Season,https://journals.ametsoc.org/downloadpdf/view/journals/clim/33/20/jcliD190592.pdf
0,AMS,clim,Volume 33,Issue 20,How Does the Quasi-Biennial Oscillation Affect the Boreal Winter Tropospheric Circulation in CMIP5/6 Models?,https://journals.ametsoc.org/downloadpdf/view/journals/clim/33/20/jcliD200024.pdf
0,AMS,clim,Volume 33,Issue 20,Assessing Global and Regional Effects of Reconstructed Land-Use and Land-Cover Change on Climate since 1950 Using a Coupled Land–Atmosphere–Ocean Model,https://journals.ametsoc.org/downloadpdf/view/journals/clim/33/20/jcliD200108.pdf
0,AMS,clim,Volume 33,Issue 20,U.K. Climate Projections: Summer Daytime and Nighttime Urban Heat Island Changes in England’s Major Cities,https://journals.ametsoc.org/downloadpdf/view/journals/clim/33/20/jcliD190961.pdf
0,AMS,clim,Volume 33,Issue 20,Decadal Variability of the Anticyclone in the Western North Pacific,https://journals.ametsoc.org/downloadpdf/view/journals/clim/33/20/jcliD200008.pdf
0,AMS,clim,Volume 33,Issue 20,Rapid Local Urbanization around Most Meteorological Stations Explains the Observed Daily Asymmetric Warming Rates across China from 1985 to 2017,https://journals.ametsoc.org/downloadpdf/view/journals/clim/33/20/jcliD200118.pdf
0,AMS,clim,Volume 33,Issue 21,Ocean Heat Storage in Response to Changing Ocean Circulation Processes,https://journals.ametsoc.org/downloadpdf/view/journals/clim/33/21/jcliD191016.pdf
0,AMS,clim,Volume 33,Issue 21,Processes Shaping the Frontal-Scale Time-Mean Surface Wind Convergence Patterns around the Gulf Stream and Agulhas Return Current in Winter,https://journals.ametsoc.org/downloadpdf/view/journals/clim/33/21/jcliD190948.pdf
0,AMS,clim,Volume 33,Issue 21,ENSO Precipitation Anomalies along the Equatorial Pacific: Moist Static Energy Framework Diagnostics,https://journals.ametsoc.org/downloadpdf/view/journals/clim/33/21/jcliD190374.pdf
0,AMS,clim,Volume 33,Issue 21,Possible Influence of Tropical Indian Ocean Sea Surface Temperature on the Proportion of Rapidly Intensifying Western North Pacific Tropical Cyclones during the Extended Boreal Summer,https://journals.ametsoc.org/downloadpdf/view/journals/clim/33/21/jcliD200087.pdf
0,AMS,clim,Volume 33,Issue 21,Tracing North Atlantic Oscillation Forecast Errors to Stratospheric Origins,https://journals.ametsoc.org/downloadpdf/view/journals/clim/33/21/jcliD200270.pdf
0,AMS,clim,Volume 33,Issue 21,The Opposing Effects of Reforestation and Afforestation on the Diurnal Temperature Cycle at the Surface and in the Lowest Atmospheric Model Level in the European Summer,https://journals.ametsoc.org/downloadpdf/view/journals/clim/33/21/jcliD190624.pdf
0,AMS,clim,Volume 33,Issue 21,Decadal Variability in the North Pacific and North Atlantic under Global Warming: The Weakening Response and Its Mechanism,https://journals.ametsoc.org/downloadpdf/view/journals/clim/33/21/jcliD191012.pdf
0,AMS,clim,Volume 33,Issue 21,"Air–Sea Interactions among Oceanic Low-Level Cloud, Sea Surface Temperature, and Atmospheric Circulation on an Intraseasonal Time Scale in the Summertime North Pacific Based on Satellite Data Analysis",https://journals.ametsoc.org/downloadpdf/view/journals/clim/33/21/jcliD190670.pdf
0,AMS,clim,Volume 33,Issue 21,Moisture Source–Receptor Network of the East Asian Summer Monsoon Land Regions and the Associated Atmospheric Steerings,https://journals.ametsoc.org/downloadpdf/view/journals/clim/33/21/jcliD190868.pdf
0,AMS,clim,Volume 33,Issue 21,A Comparison of Intra-Annual and Long-Term Trend Scaling of Extreme Precipitation with Temperature in a Large-Ensemble Regional Climate Simulation,https://journals.ametsoc.org/downloadpdf/view/journals/clim/33/21/jcliD190920.pdf
0,AMS,clim,Volume 33,Issue 21,Dependence of Beaufort Sea Low Ice Condition in the Summer of 1998 on Ice Export in the Prior Winter,https://journals.ametsoc.org/downloadpdf/view/journals/clim/33/21/jcliD190943.pdf
0,AMS,clim,Volume 33,Issue 21,Quantifying the Anthropogenic Greenhouse Gas Contribution to the Observed Spring Snow-Cover Decline Using the CMIP6 Multimodel Ensemble,https://journals.ametsoc.org/downloadpdf/view/journals/clim/33/21/jcliD200002.pdf
0,AMS,clim,Volume 33,Issue 21,Mesoscale Convective System Precipitation Characteristics over East Asia. Part I: Regional Differences and Seasonal Variations,https://journals.ametsoc.org/downloadpdf/view/journals/clim/33/21/jcliD200072.pdf
