,Website,Journal,Volume,Issue,Title,Download Link
0,AMS,clim,Volume 34,Issue 6,The Niño-3.4 Prediction Skill of Empirically Adjusted Wind Power,https://journals.ametsoc.org/downloadpdf/view/journals/clim/34/6/JCLI-D-20-0045.1.pdf
0,AMS,clim,Volume 34,Issue 6,Contribution of Ocean Physics and Dynamics at Different Scales to Heat Uptake in Low-Resolution AOGCMs,https://journals.ametsoc.org/downloadpdf/view/journals/clim/34/6/JCLI-D-20-0652.1.pdf
0,AMS,clim,Volume 34,Issue 6,Drivers of Eurasian Spring Snow-Cover Variability,https://journals.ametsoc.org/downloadpdf/view/journals/clim/34/6/JCLI-D-20-0413.1.pdf
0,AMS,clim,Volume 34,Issue 6,Drought and Flood Characterization and Connection to Climate Variability in the Pearl River Basin in Southern China Using Long-Term GRACE and Reanalysis Data,https://journals.ametsoc.org/downloadpdf/view/journals/clim/34/6/JCLI-D-20-0332.1.pdf
0,AMS,clim,Volume 34,Issue 6,The Role of Radiative Interactions in Tropical Cyclone Development under Realistic Boundary Conditions,https://journals.ametsoc.org/downloadpdf/view/journals/clim/34/6/JCLI-D-20-0574.1.pdf
0,AMS,clim,Volume 34,Issue 6,Assessing the Influence of Large-Scale Environmental Conditions on the Rainfall Structure of Atlantic Tropical Cyclones: An Observational Study,https://journals.ametsoc.org/downloadpdf/view/journals/clim/34/6/JCLI-D-20-0376.1.pdf
0,AMS,clim,Volume 34,Issue 6,Assimilation of Satellite-Retrieved Sea Ice Concentration and Prospects for September Predictions of Arctic Sea Ice,https://journals.ametsoc.org/downloadpdf/view/journals/clim/34/6/JCLI-D-20-0469.1.pdf
0,AMS,clim,Volume 34,Issue 6,Modulation of North Pacific and North Atlantic Tropical Cyclones by Tropical Transbasin Variability and ENSO during May–October,https://journals.ametsoc.org/downloadpdf/view/journals/clim/34/6/JCLI-D-19-0866.1.pdf
0,AMS,clim,Volume 34,Issue 6,A Theory of the Spring Persistence Barrier on ENSO. Part I: The Role of ENSO Period,https://journals.ametsoc.org/downloadpdf/view/journals/clim/34/6/JCLI-D-20-0540.1.pdf
0,AMS,clim,Volume 34,Issue 6,Comparison of Regional Climate Model Performances for Different Types of Heat Waves over South Korea,https://journals.ametsoc.org/downloadpdf/view/journals/clim/34/6/JCLI-D-20-0422.1.pdf
0,AMS,clim,Volume 34,Issue 6,Characterizing the Relationship between Temperature and Soil Moisture Extremes and Their Role in the Exacerbation of Heat Waves over the Contiguous United States,https://journals.ametsoc.org/downloadpdf/view/journals/clim/34/6/JCLI-D-20-0440.1.pdf
0,AMS,clim,Volume 34,Issue 6,Modeled Response of South American Climate to Three Decades of Deforestation,https://journals.ametsoc.org/downloadpdf/view/journals/clim/34/6/JCLI-D-20-0380.1.pdf
0,AMS,clim,Volume 34,Issue 6,Impacts of Low-Frequency Internal Climate Variability and Greenhouse Warming on El Niño–Southern Oscillation,https://journals.ametsoc.org/downloadpdf/view/journals/clim/34/6/JCLI-D-20-0232.1.pdf
0,AMS,clim,Volume 34,Issue 6,Global Near-Surface Wind Speed Changes over the Last Decades Revealed by Reanalyses and CMIP6 Model Simulations,https://journals.ametsoc.org/downloadpdf/view/journals/clim/34/6/JCLI-D-20-0310.1.pdf
0,AMS,clim,Volume 34,Issue 6,Future Changes in Tropical Cyclone Intensity and Frequency over the Western North Pacific Based on 20-km HiRAM and MRI Models,https://journals.ametsoc.org/downloadpdf/view/journals/clim/34/6/JCLI-D-20-0417.1.pdf
0,AMS,clim,Volume 34,Issue 6,"Terrestrial Evaporation and Global Climate: Lessons from Northland, a Planet with a Hemispheric Continent",https://journals.ametsoc.org/downloadpdf/view/journals/clim/34/6/JCLI-D-20-0452.1.pdf
0,AMS,clim,Volume 34,Issue 6,Changes in North Atlantic Atmospheric Circulation in a Warmer Climate Favor Winter Flooding and Summer Drought over Europe,https://journals.ametsoc.org/downloadpdf/view/journals/clim/34/6/JCLI-D-20-0311.1.pdf
0,AMS,clim,Volume 34,Issue 6,Diversity of the Madden–Julian Oscillation: Initiation Region Modulated by the Interaction between the Intraseasonal and Interannual Variabilities,https://journals.ametsoc.org/downloadpdf/view/journals/clim/34/6/JCLI-D-20-0688.1.pdf
0,AMS,clim,Volume 34,Issue 6,Using Bayesian Networks to Investigate the Influence of Subseasonal Arctic Variability on Midlatitude North Atlantic Circulation,https://journals.ametsoc.org/downloadpdf/view/journals/clim/34/6/JCLI-D-20-0369.1.pdf
0,AMS,clim,Volume 34,Issue 6,Extreme Snow Events along the Coast of the Northeast United States: Potential Changes due to Global Warming,https://journals.ametsoc.org/downloadpdf/view/journals/clim/34/6/JCLI-D-20-0197.1.pdf
0,AMS,clim,Volume 34,Issue 6,Decomposing the Drivers of Polar Amplification with a Single-Column Model,https://journals.ametsoc.org/downloadpdf/view/journals/clim/34/6/JCLI-D-20-0178.1.pdf
0,AMS,clim,Volume 34,Issue 6,Nonlinear Response of Atmospheric Blocking to Early Winter Barents–Kara Seas Warming: An Idealized Model Study,https://journals.ametsoc.org/downloadpdf/view/journals/clim/34/6/JCLI-D-19-0720.1.pdf
0,AMS,clim,Volume 34,Issue 7,Climate Extremes across the North American Arctic in Modern Reanalyses,https://journals.ametsoc.org/downloadpdf/view/journals/clim/34/7/JCLI-D-20-0093.1.pdf
0,AMS,clim,Volume 34,Issue 7,North Atlantic Winter Storm Activity in Modern Reanalyses and Pressure-Based Observations,https://journals.ametsoc.org/downloadpdf/view/journals/clim/34/7/JCLI-D-20-0529.1.pdf
0,AMS,clim,Volume 34,Issue 7,The Contribution of Internal Variability to Asian Midlatitude Warming,https://journals.ametsoc.org/downloadpdf/view/journals/clim/34/7/JCLI-D-20-0231.1.pdf
0,AMS,clim,Volume 34,Issue 7,The Crucial Role of Synoptic Pattern in Determining the Spatial Distribution and Diurnal Cycle of Heavy Rainfall over the South China Coast,https://journals.ametsoc.org/downloadpdf/view/journals/clim/34/7/JCLI-D-20-0274.1.pdf
0,AMS,clim,Volume 34,Issue 7,Cross-Basin Interactions between the Tropical Atlantic and Pacific in the ECMWF Hindcasts,https://journals.ametsoc.org/downloadpdf/view/journals/clim/34/7/JCLI-D-20-0140.1.pdf
0,AMS,clim,Volume 34,Issue 7,Improving Australian Rainfall Prediction Using Sea Surface Salinity,https://journals.ametsoc.org/downloadpdf/view/journals/clim/34/7/JCLI-D-20-0625.1.pdf
0,AMS,clim,Volume 34,Issue 7,On the Generation of Weddell Sea Polynyas in a High-Resolution Earth System Model,https://journals.ametsoc.org/downloadpdf/view/journals/clim/34/7/JCLI-D-20-0229.1.pdf
0,AMS,clim,Volume 34,Issue 7,The Observed Relationship between Pacific SST Variability and Hadley Cell Extent Trends in Reanalyses,https://journals.ametsoc.org/downloadpdf/view/journals/clim/34/7/JCLI-D-20-0410.1.pdf
0,AMS,clim,Volume 34,Issue 7,On the Role of the Antarctic Slope Front on the Occurrence of the Weddell Sea Polynya under Climate Change,https://journals.ametsoc.org/downloadpdf/view/journals/clim/34/7/JCLI-D-20-0069.1.pdf
0,AMS,clim,Volume 34,Issue 7,A Multidecadal-Scale Tropically Driven Global Teleconnection over the Past Millennium and Its Recent Strengthening,https://journals.ametsoc.org/downloadpdf/view/journals/clim/34/7/JCLI-D-20-0216.1.pdf
0,AMS,clim,Volume 34,Issue 7,Quantifying the Role of Ocean Dynamics in Ocean Mixed Layer Temperature Variability,https://journals.ametsoc.org/downloadpdf/view/journals/clim/34/7/JCLI-D-20-0476.1.pdf
0,AMS,clim,Volume 34,Issue 7,Arctic Amplification Weakens the Variability of Daily Temperatures over Northern Middle-High Latitudes,https://journals.ametsoc.org/downloadpdf/view/journals/clim/34/7/JCLI-D-20-0514.1.pdf
0,AMS,clim,Volume 34,Issue 7,Evaluation of Mesoscale Convective Systems in Climate Simulations: Methodological Development and Results from MPAS-CAM over the United States,https://journals.ametsoc.org/downloadpdf/view/journals/clim/34/7/JCLI-D-20-0136.1.pdf
0,AMS,clim,Volume 34,Issue 7,Regionalization of Seasonal Precipitation over the Tibetan Plateau and Associated Large-Scale Atmospheric Systems,https://journals.ametsoc.org/downloadpdf/view/journals/clim/34/7/JCLI-D-20-0521.1.pdf
0,AMS,clim,Volume 34,Issue 7,Extreme Temperatures in the Antarctic,https://journals.ametsoc.org/downloadpdf/view/journals/clim/34/7/JCLI-D-20-0538.1.pdf
0,AMS,clim,Volume 34,Issue 7,Interannual to Decadal Variability of Tropical Indian Ocean Sea Surface Temperature: Pacific Influence versus Local Internal Variability,https://journals.ametsoc.org/downloadpdf/view/journals/clim/34/7/JCLI-D-20-0807.1.pdf
0,AMS,clim,Volume 34,Issue 7,Decadal Modulation of the ENSO–Indian Ocean Basin Warming Relationship during the Decaying Summer by the Interdecadal Pacific Oscillation,https://journals.ametsoc.org/downloadpdf/view/journals/clim/34/7/JCLI-D-20-0457.1.pdf
0,AMS,clim,Volume 34,Issue 7,Evaluation of the Tail of the Probability Distribution of Daily and Subdaily Precipitation in CMIP6 Models,https://journals.ametsoc.org/downloadpdf/view/journals/clim/34/7/JCLI-D-20-0182.1.pdf
0,AMS,clim,Volume 34,Issue 7,Seasonal Variation of the Westerly Jet over Asia in the Last Glacial Maximum: Role of the Tibetan Plateau Heating,https://journals.ametsoc.org/downloadpdf/view/journals/clim/34/7/JCLI-D-20-0438.1.pdf
0,AMS,clim,Volume 34,Issue 7,Changes in Future Precipitation Mean and Variability across Scales,https://journals.ametsoc.org/downloadpdf/view/journals/clim/34/7/JCLI-D-20-0001.1.pdf
0,AMS,clim,Volume 34,Issue 7,Explaining the Spatial Pattern of U.S. Extreme Daily Precipitation Change,https://journals.ametsoc.org/downloadpdf/view/journals/clim/34/7/JCLI-D-20-0666.1.pdf
0,AMS,clim,Volume 34,Issue 7,Dynamic Control of the Dominant Modes of Interannual Variability of Snowfall Frequency in China,https://journals.ametsoc.org/downloadpdf/view/journals/clim/34/7/JCLI-D-20-0705.1.pdf
0,AMS,clim,Volume 34,Issue 7,Contrasting Interannual Prediction between January and February Temperature in Southern China in the NCEP Climate Forecast System,https://journals.ametsoc.org/downloadpdf/view/journals/clim/34/7/JCLI-D-20-0568.1.pdf
0,AMS,clim,Volume 34,Issue 8,Origins of the Excessive Westward Extension of ENSO SST Simulated in CMIP5 and CMIP6 Models,https://journals.ametsoc.org/downloadpdf/view/journals/clim/34/8/JCLI-D-20-0551.1.pdf
0,AMS,clim,Volume 34,Issue 8,Compatible Fossil Fuel CO2 Emissions in the CMIP6 Earth System Models’ Historical and Shared Socioeconomic Pathway Experiments of the Twenty-First Century,https://journals.ametsoc.org/downloadpdf/view/journals/clim/34/8/JCLI-D-19-0991.1.pdf
0,AMS,clim,Volume 34,Issue 8,Efficiency of Time Series Homogenization: Method Comparison with 12 Monthly Temperature Test Datasets,https://journals.ametsoc.org/downloadpdf/view/journals/clim/34/8/JCLI-D-20-0611.1.pdf
0,AMS,clim,Volume 34,Issue 8,Global Surface Temperature Response to 11-Yr Solar Cycle Forcing Consistent with General Circulation Model Results,https://journals.ametsoc.org/downloadpdf/view/journals/clim/34/8/JCLI-D-20-0312.1.pdf
0,AMS,clim,Volume 34,Issue 8,Prediction of Arctic Temperature and Sea Ice Using a High-Resolution Coupled Model,https://journals.ametsoc.org/downloadpdf/view/journals/clim/34/8/JCLI-D-20-0227.1.pdf
0,AMS,clim,Volume 34,Issue 8,Improvements of the Daily Optimum Interpolation Sea Surface Temperature (DOISST) Version 2.1,https://journals.ametsoc.org/downloadpdf/view/journals/clim/34/8/JCLI-D-20-0166.1.pdf
0,AMS,clim,Volume 34,Issue 8,Drivers of Local Ocean Heat Content Variability in ECCOv4,https://journals.ametsoc.org/downloadpdf/view/journals/clim/34/8/JCLI-D-20-0058.1.pdf
0,AMS,clim,Volume 34,Issue 8,The Role of Horizontal Temperature Advection in Arctic Amplification,https://journals.ametsoc.org/downloadpdf/view/journals/clim/34/8/JCLI-D-19-0937.1.pdf
0,AMS,clim,Volume 34,Issue 8,Intercomparison of MJO Column Moist Static Energy and Water Vapor Budget among Six Modern Reanalysis Products,https://journals.ametsoc.org/downloadpdf/view/journals/clim/34/8/JCLI-D-20-0653.1.pdf
0,AMS,clim,Volume 34,Issue 8,Influences of Summertime Arctic Dipole Atmospheric Circulation on Sea Ice Concentration Variations in the Pacific Sector of the Arctic during Different Pacific Decadal Oscillation Phases,https://journals.ametsoc.org/downloadpdf/view/journals/clim/34/8/JCLI-D-19-0843.1.pdf
0,AMS,clim,Volume 34,Issue 8,Observed Statistical Connections Overestimate the Causal Effects of Arctic Sea Ice Changes on Midlatitude Winter Climate,https://journals.ametsoc.org/downloadpdf/view/journals/clim/34/8/JCLI-D-20-0293.1.pdf
0,AMS,clim,Volume 34,Issue 8,Enhanced Tropical Eastern Indian Ocean Rainfall Breaks Down the Tropical Easterly Jet–Indian Rainfall Relationship,https://journals.ametsoc.org/downloadpdf/view/journals/clim/34/8/JCLI-D-20-0631.1.pdf
0,AMS,clim,Volume 34,Issue 8,The Fast Response of the Atmospheric Water Cycle to Anthropogenic Black Carbon Aerosols during Summer in East Asia,https://journals.ametsoc.org/downloadpdf/view/journals/clim/34/8/JCLI-D-20-0492.1.pdf
0,AMS,clim,Volume 34,Issue 8,Observed and Projected Frontal Activities in East Asia,https://journals.ametsoc.org/downloadpdf/view/journals/clim/34/8/JCLI-D-19-0959.1.pdf
0,AMS,clim,Volume 34,Issue 8,Seasonal Evolution of Anomalous Rainband over East China Regulated by Sea Surface Temperature Anomalies in the Northern Hemisphere,https://journals.ametsoc.org/downloadpdf/view/journals/clim/34/8/JCLI-D-20-0398.1.pdf
0,AMS,clim,Volume 34,Issue 8,"A Decline of Observed Daily Peak Wind Gusts with Distinct Seasonality in Australia, 1941–2016",https://journals.ametsoc.org/downloadpdf/view/journals/clim/34/8/JCLI-D-20-0590.1.pdf
0,AMS,clim,Volume 34,Issue 8,Increasing Warm-Season Precipitation in Asian Drylands and Response to Reducing Spring Snow Cover over the Tibetan Plateau,https://journals.ametsoc.org/downloadpdf/view/journals/clim/34/8/JCLI-D-20-0479.1.pdf
0,AMS,clim,Volume 34,Issue 8,Change in the Occurrence Frequency of Landfalling and Non-Landfalling Tropical Cyclones over the Northwest Pacific,https://journals.ametsoc.org/downloadpdf/view/journals/clim/34/8/JCLI-D-20-0647.1.pdf
0,AMS,clim,Volume 34,Issue 8,A Mass and Energy Conservation Analysis of Drift in the CMIP6 Ensemble,https://journals.ametsoc.org/downloadpdf/view/journals/clim/34/8/JCLI-D-20-0281.1.pdf
0,AMS,clim,Volume 34,Issue 8,Interdecadal Change in the Relationship between the Winter North Pacific Storm Track and the East Asian Winter Monsoon,https://journals.ametsoc.org/downloadpdf/view/journals/clim/34/8/JCLI-D-20-0372.1.pdf
0,AMS,clim,Volume 34,Issue 8,Evaluating the Diurnal and Semidiurnal Cycle of Precipitation in CMIP6 Models Using Satellite- and Ground-Based Observations,https://journals.ametsoc.org/downloadpdf/view/journals/clim/34/8/JCLI-D-20-0639.1.pdf
0,AMS,clim,Volume 34,Issue 8,Comparison of Convective Parameters Derived from ERA5 and MERRA-2 with Rawinsonde Data over Europe and North America,https://journals.ametsoc.org/downloadpdf/view/journals/clim/34/8/JCLI-D-20-0484.1.pdf
0,AMS,clim,Volume 34,Issue 8,Southward Cold Airmass Flux Associated with the East Asian Winter Monsoon: Diversity and Impacts,https://journals.ametsoc.org/downloadpdf/view/journals/clim/34/8/JCLI-D-20-0319.1.pdf
0,AMS,clim,Volume 34,Issue 8,Delayed Impact of Indian Ocean Warming on the East Asian Surface Temperature Variation in Boreal Summer,https://journals.ametsoc.org/downloadpdf/view/journals/clim/34/8/JCLI-D-20-0691.1.pdf
0,AMS,clim,Volume 34,Issue 9,Sources of Subseasonal Predictability over CONUS during Boreal Summer,https://journals.ametsoc.org/downloadpdf/view/journals/clim/34/9/JCLI-D-20-0586.1.pdf
0,AMS,clim,Volume 34,Issue 9,Transient Climate Response to Arctic Sea Ice Loss with Two Ice-Constraining Methods,https://journals.ametsoc.org/downloadpdf/view/journals/clim/34/9/JCLI-D-20-0288.1.pdf
0,AMS,clim,Volume 34,Issue 9,Kenyan Long Rains: A Subseasonal Approach to Process-Based Diagnostics,https://journals.ametsoc.org/downloadpdf/view/journals/clim/34/9/JCLI-D-19-0914.1.pdf
0,AMS,clim,Volume 34,Issue 9,Seasonal Sensitivity of the Cross-Equatorial Hadley Cell Response to Extratropical Thermal Forcings,https://journals.ametsoc.org/downloadpdf/view/journals/clim/34/9/JCLI-D-19-0938.1.pdf
0,AMS,clim,Volume 34,Issue 9,Explicit versus Parameterized Convection in Response to the Atlantic Meridional Mode,https://journals.ametsoc.org/downloadpdf/view/journals/clim/34/9/JCLI-D-20-0224.1.pdf
0,AMS,clim,Volume 34,Issue 9,Predictable Mode of Tropical Intraseasonal Variability in Boreal Summer,https://journals.ametsoc.org/downloadpdf/view/journals/clim/34/9/JCLI-D-20-0630.1.pdf
0,AMS,clim,Volume 34,Issue 9,Transient Extratropical Response to Solar Ultraviolet Radiation in the Northern Hemisphere Winter,https://journals.ametsoc.org/downloadpdf/view/journals/clim/34/9/JCLI-D-20-0655.1.pdf
0,AMS,clim,Volume 34,Issue 9,Impact of Developing ENSO on Tibetan Plateau Summer Rainfall,https://journals.ametsoc.org/downloadpdf/view/journals/clim/34/9/JCLI-D-20-0612.1.pdf
0,AMS,clim,Volume 34,Issue 9,Climatology of Borneo Vortices in the HadGEM3-GC3.1 General Circulation Model,https://journals.ametsoc.org/downloadpdf/view/journals/clim/34/9/JCLI-D-20-0604.1.pdf
0,AMS,clim,Volume 34,Issue 9,Mechanisms of Decadal North Atlantic Climate Variability and Implications for the Recent Cold Anomaly,https://journals.ametsoc.org/downloadpdf/view/journals/clim/34/9/JCLI-D-20-0464.1.pdf
0,AMS,clim,Volume 34,Issue 9,Changes in Annual Extremes of Daily Temperature and Precipitation in CMIP6 Models,https://journals.ametsoc.org/downloadpdf/view/journals/clim/34/9/JCLI-D-19-1013.1.pdf
0,AMS,clim,Volume 34,Issue 9,Recent Water Mass Changes Reveal Mechanisms of Ocean Warming,https://journals.ametsoc.org/downloadpdf/view/journals/clim/34/9/JCLI-D-20-0355.1.pdf
0,AMS,clim,Volume 34,Issue 9,"ENSO Diversity in a Tropical Stochastic Skeleton Model for the MJO, El Niño, and Dynamic Walker Circulation",https://journals.ametsoc.org/downloadpdf/view/journals/clim/34/9/JCLI-D-20-0447.1.pdf
0,AMS,clim,Volume 34,Issue 9,Interdecadal Variation of the Wintertime Precipitation in Southeast Asia and Its Possible Causes,https://journals.ametsoc.org/downloadpdf/view/journals/clim/34/9/JCLI-D-20-0480.1.pdf
0,AMS,clim,Volume 34,Issue 9,Dynamics of East Asian Spring Rainband and Spring–Autumn Contrast: Environmental Forcings of Large-Scale Circulation,https://journals.ametsoc.org/downloadpdf/view/journals/clim/34/9/JCLI-D-20-0501.1.pdf
0,AMS,clim,Volume 34,Issue 9,Radiative and Dynamic Controls on Atmospheric Heat Transport over Different Planetary Rotation Rates,https://journals.ametsoc.org/downloadpdf/view/journals/clim/34/9/JCLI-D-20-0533.1.pdf
0,AMS,clim,Volume 34,Issue 9,The Strong Upwelling Event off the Southern Coast of Sri Lanka in 2013 and Its Relationship with Indian Ocean Dipole Events,https://journals.ametsoc.org/downloadpdf/view/journals/clim/34/9/JCLI-D-20-0620.1.pdf
0,AMS,clim,Volume 34,Issue 9,Local Atmospheric Response to the Kuroshio Large Meander Path in Summer and Its Remote Influence on the Climate of Japan,https://journals.ametsoc.org/downloadpdf/view/journals/clim/34/9/JCLI-D-20-0387.1.pdf
0,AMS,clim,Volume 34,Issue 9,Impact of the Indian Ocean Dipole on Evolution of the Subsequent ENSO: Relative Roles of Dynamic and Thermodynamic Processes,https://journals.ametsoc.org/downloadpdf/view/journals/clim/34/9/JCLI-D-20-0487.1.pdf
0,AMS,clim,Volume 34,Issue 9,Assessment and Ranking of Climate Models in Arctic Sea Ice Cover Simulation: From CMIP5 to CMIP6,https://journals.ametsoc.org/downloadpdf/view/journals/clim/34/9/JCLI-D-20-0294.1.pdf
0,AMS,clim,Volume 34,Issue 9,"Assessing ENSO Summer Teleconnections, Impacts, and Predictability in North America",https://journals.ametsoc.org/downloadpdf/view/journals/clim/34/9/JCLI-D-20-0761.1.pdf
0,AMS,clim,Volume 34,Issue 9,What Modulates the Intensity of Synoptic-Scale Variability over the Western North Pacific during Boreal Summer and Fall?,https://journals.ametsoc.org/downloadpdf/view/journals/clim/34/9/JCLI-D-20-0477.1.pdf
0,AMS,clim,Volume 34,Issue 9,Contrasting Cloud Regimes and Associated Rainfall over the South Asian and East Asian Monsoon Regions,https://journals.ametsoc.org/downloadpdf/view/journals/clim/34/9/JCLI-D-20-0992.1.pdf
0,AMS,clim,Volume 34,Issue 9,Observed Extreme Air–Sea Heat Flux Variations during Three Tropical Cyclones in the Tropical Southeastern Indian Ocean,https://journals.ametsoc.org/downloadpdf/view/journals/clim/34/9/JCLI-D-20-0170.1.pdf
0,AMS,clim,Volume 34,Issue 9,Combined Effects of the British–Baikal Corridor Pattern and the Silk Road Pattern on Eurasian Surface Air Temperatures in Summer,https://journals.ametsoc.org/downloadpdf/view/journals/clim/34/9/JCLI-D-20-0325.1.pdf
0,AMS,clim,Volume 34,Issue 10,Midlatitude Winter Extreme Temperature Events and Connections with Anomalies in the Arctic and Tropics,https://journals.ametsoc.org/downloadpdf/view/journals/clim/34/10/JCLI-D-20-0371.1.pdf
0,AMS,clim,Volume 34,Issue 10,Are 100 Ensemble Members Enough to Capture the Remote Atmospheric Response to +2°C Arctic Sea Ice Loss?,https://journals.ametsoc.org/downloadpdf/view/journals/clim/34/10/JCLI-D-20-0613.1.pdf
0,AMS,clim,Volume 34,Issue 10,Relative Roles of Energy and Momentum Fluxes in the Tropical Response to Extratropical Thermal Forcing,https://journals.ametsoc.org/downloadpdf/view/journals/clim/34/10/JCLI-D-20-0151.1.pdf
0,AMS,clim,Volume 34,Issue 10,The Influence of South Pacific Convergence Zone Heating on the South Pacific Subtropical Anticyclone,https://journals.ametsoc.org/downloadpdf/view/journals/clim/34/10/JCLI-D-20-0509.1.pdf
0,AMS,clim,Volume 34,Issue 10,Importance of Human-Induced Nitrogen Flux Increases for Simulated Arctic Warming,https://journals.ametsoc.org/downloadpdf/view/journals/clim/34/10/JCLI-D-20-0180.1.pdf
0,AMS,clim,Volume 34,Issue 10,Protected Convection as a Metric of Dry Air Influence on Precipitation,https://journals.ametsoc.org/downloadpdf/view/journals/clim/34/10/JCLI-D-20-0384.1.pdf
0,AMS,clim,Volume 34,Issue 10,Reconstructing an Interdecadal Pacific Oscillation Index from a Pacific Basin–Wide Collection of Ice Core Records,https://journals.ametsoc.org/downloadpdf/view/journals/clim/34/10/JCLI-D-20-0455.1.pdf
0,AMS,clim,Volume 34,Issue 10,Improvement of ERA5 over ERA-Interim in Simulating Surface Incident Solar Radiation throughout China,https://journals.ametsoc.org/downloadpdf/view/journals/clim/34/10/JCLI-D-20-0300.1.pdf
0,AMS,clim,Volume 34,Issue 10,Recent Intensified Influence of the Winter North Pacific Sea Surface Temperature on the Mei-Yu Withdrawal Date,https://journals.ametsoc.org/downloadpdf/view/journals/clim/34/10/JCLI-D-19-0768.1.pdf
0,AMS,clim,Volume 34,Issue 10,Assessing Prior Emergent Constraints on Surface Albedo Feedback in CMIP6,https://journals.ametsoc.org/downloadpdf/view/journals/clim/34/10/JCLI-D-20-0703.1.pdf
0,AMS,clim,Volume 34,Issue 10,Regional Asymmetries in Ocean Heat and Carbon Storage due to Dynamic Redistribution in Climate Model Projections,https://journals.ametsoc.org/downloadpdf/view/journals/clim/34/10/JCLI-D-20-0519.1.pdf
0,AMS,clim,Volume 34,Issue 10,Spiciness Anomalies of Subantarctic Mode Water in the South Indian Ocean,https://journals.ametsoc.org/downloadpdf/view/journals/clim/34/10/JCLI-D-20-0482.1.pdf
0,AMS,clim,Volume 34,Issue 10,"Consistency and Homogeneity of Atmospheric Energy, Moisture, and Mass Budgets in ERA5",https://journals.ametsoc.org/downloadpdf/view/journals/clim/34/10/JCLI-D-20-0676.1.pdf
0,AMS,clim,Volume 34,Issue 10,Drivers of Atmospheric and Oceanic Surface Temperature Variance: A Frequency Domain Approach,https://journals.ametsoc.org/downloadpdf/view/journals/clim/34/10/JCLI-D-20-0557.1.pdf
0,AMS,clim,Volume 34,Issue 10,Radiative Impacts of Low-Level Clouds on the Summertime Subtropical High in the South Indian Ocean Simulated in a Coupled General Circulation Model,https://journals.ametsoc.org/downloadpdf/view/journals/clim/34/10/JCLI-D-20-0709.1.pdf
0,AMS,clim,Volume 34,Issue 10,Tropical and Extratropical Influences on the Variability of the Southern Hemisphere Wintertime Subtropical Jet,https://journals.ametsoc.org/downloadpdf/view/journals/clim/34/10/JCLI-D-20-0460.1.pdf
0,AMS,clim,Volume 34,Issue 10,Energy Flow Diagnosis of ENSO from an Ocean Reanalysis,https://journals.ametsoc.org/downloadpdf/view/journals/clim/34/10/JCLI-D-20-0704.1.pdf
0,AMS,clim,Volume 34,Issue 10,Rising Planetary Boundary Layer Height over the Sahara Desert and Arabian Peninsula in a Warming Climate,https://journals.ametsoc.org/downloadpdf/view/journals/clim/34/10/JCLI-D-20-0645.1.pdf
0,AMS,clim,Volume 34,Issue 10,Two-Year Dynamical Predictions of ENSO Event Duration during 1954–2015,https://journals.ametsoc.org/downloadpdf/view/journals/clim/34/10/JCLI-D-20-0619.1.pdf
0,AMS,clim,Volume 34,Issue 10,On the Varying Responses of East Asian Winter Monsoon to Three Types of El Niño: Observations and Model Hindcasts,https://journals.ametsoc.org/downloadpdf/view/journals/clim/34/10/JCLI-D-20-0784.1.pdf
0,AMS,clim,Volume 34,Issue 10,Roles of Tropical Remote Forcings on the South China Sea Winter Atmospheric and Cold Tongue Variabilities,https://journals.ametsoc.org/downloadpdf/view/journals/clim/34/10/JCLI-D-20-0657.1.pdf
0,AMS,clim,Volume 34,Issue 10,Arctic Cyclone Activity and the Beaufort High,https://journals.ametsoc.org/downloadpdf/view/journals/clim/34/10/JCLI-D-20-0771.1.pdf
0,AMS,clim,Volume 34,Issue 10,The Impact of the Stratospheric Polar Vortex Shift on the Arctic Oscillation,https://journals.ametsoc.org/downloadpdf/view/journals/clim/34/10/JCLI-D-20-0536.1.pdf
0,AMS,clim,Volume 34,Issue 10,Direct Influence of Solar Spectral Irradiance on the High-Latitude Surface Climate,https://journals.ametsoc.org/downloadpdf/view/journals/clim/34/10/JCLI-D-20-0743.1.pdf
0,AMS,clim,Volume 34,Issue 10,The Shallowing Surface Temperature Inversions in the Arctic,https://journals.ametsoc.org/downloadpdf/view/journals/clim/34/10/JCLI-D-20-0621.1.pdf
