,Website,Journal,Volume,Issue,Title,Download Link
0,AMS,clim,Volume 36,Issue 7,The Role of Atmospheric Noise in Decadal SST Variability,https://journals.ametsoc.org/downloadpdf/view/journals/clim/36/7/JCLI-D-22-0399.1.pdf
0,AMS,clim,Volume 36,Issue 7,Evaluation of Changes in Dry and Wet Precipitation Extremes in Warmer Climates Using a Passive Water Vapor Modeling Approach,https://journals.ametsoc.org/downloadpdf/view/journals/clim/36/7/JCLI-D-22-0048.1.pdf
0,AMS,clim,Volume 36,Issue 7,Historical Ocean Heat Uptake in Two Pairs of CMIP6 Models: Global and Regional Perspectives,https://journals.ametsoc.org/downloadpdf/view/journals/clim/36/7/JCLI-D-22-0468.1.pdf
0,AMS,clim,Volume 36,Issue 7,Global and Regional Discrepancies between Early-Twentieth-Century Coastal Air and Sea Surface Temperature Detected by a Coupled Energy-Balance Analysis,https://journals.ametsoc.org/downloadpdf/view/journals/clim/36/7/JCLI-D-22-0569.1.pdf
0,AMS,clim,Volume 36,Issue 7,Heat Storage in the Upper Indian Ocean: The Role of Wind-Driven Redistribution,https://journals.ametsoc.org/downloadpdf/view/journals/clim/36/7/JCLI-D-22-0534.1.pdf
0,AMS,clim,Volume 36,Issue 7,Increasing Compound Hazards of Tropical Cyclones and Heatwaves over Southeastern Coast of China under Climate Warming,https://journals.ametsoc.org/downloadpdf/view/journals/clim/36/7/JCLI-D-22-0279.1.pdf
0,AMS,clim,Volume 36,Issue 7,The Stratosphere–Troposphere Oscillation as the Dominant Intraseasonal Coupling Mode between the Stratosphere and Troposphere,https://journals.ametsoc.org/downloadpdf/view/journals/clim/36/7/JCLI-D-22-0238.1.pdf
0,AMS,clim,Volume 36,Issue 7,Changes and Mechanisms of Long-Lived Warm Blobs in the Northeast Pacific in Low-Warming Climates,https://journals.ametsoc.org/downloadpdf/view/journals/clim/36/7/JCLI-D-22-0152.1.pdf
0,AMS,clim,Volume 36,Issue 7,Subsurface Thermohaline Biases in the Southern Tropical Pacific and the Roles of Wind Stress and Precipitation,https://journals.ametsoc.org/downloadpdf/view/journals/clim/36/7/JCLI-D-22-0524.1.pdf
0,AMS,clim,Volume 36,Issue 8,Can Polar Stratospheric Clouds Explain Arctic Amplification?,https://journals.ametsoc.org/downloadpdf/view/journals/clim/36/8/JCLI-D-22-0497.1.pdf
0,AMS,clim,Volume 36,Issue 8,RARE: The Regional Arctic Reanalysis,https://journals.ametsoc.org/downloadpdf/view/journals/clim/36/8/JCLI-D-22-0340.1.pdf
0,AMS,clim,Volume 36,Issue 8,Structural and Environmental Characteristics of Western Baiu Frontal Depressions,https://journals.ametsoc.org/downloadpdf/view/journals/clim/36/8/JCLI-D-22-0515.1.pdf
0,AMS,clim,Volume 36,Issue 8,The Varying Earth’s Radiative Feedback Connected to the Ocean Energy Uptake: A Theoretical Perspective from Conceptual Frameworks,https://journals.ametsoc.org/downloadpdf/view/journals/clim/36/8/JCLI-D-22-0345.1.pdf
0,AMS,clim,Volume 36,Issue 8,Drivers of an Ecologically Relevant Summer North American Dipole,https://journals.ametsoc.org/downloadpdf/view/journals/clim/36/8/JCLI-D-22-0542.1.pdf
0,AMS,clim,Volume 36,Issue 8,"Changes in Summer Precipitation Modes over Eastern China in Simulated Warm Intervals of the Last Interglacial, Mid-Holocene, and Twenty-First Century",https://journals.ametsoc.org/downloadpdf/view/journals/clim/36/8/JCLI-D-21-1002.1.pdf
0,AMS,clim,Volume 36,Issue 8,Exploring Subtropical Stratocumulus Multiple Equilibria Using a Mixed-Layer Model,https://journals.ametsoc.org/downloadpdf/view/journals/clim/36/8/JCLI-D-22-0528.1.pdf
0,AMS,clim,Volume 36,Issue 8,The Impact of Tropical Pacific SST Biases on the S2S Forecast Skill over North America in the UFS Global Coupled Model,https://journals.ametsoc.org/downloadpdf/view/journals/clim/36/8/JCLI-D-22-0196.1.pdf
0,AMS,clim,Volume 36,Issue 8,Principal Modes of Diurnal Cycle of Rainfall over South China during the Presummer Rainy Season,https://journals.ametsoc.org/downloadpdf/view/journals/clim/36/8/JCLI-D-22-0284.1.pdf
0,AMS,clim,Volume 36,Issue 8,The Relative Warming Rates of Heat Events and Median Days in the Pacific Northwest from Observations and a Regional Climate Model,https://journals.ametsoc.org/downloadpdf/view/journals/clim/36/8/JCLI-D-22-0313.1.pdf
0,AMS,clim,Volume 36,Issue 8,Decadal Shift in Summer Precipitation Variability over East Asia in the Mid-2000s and Wave Propagation toward North America,https://journals.ametsoc.org/downloadpdf/view/journals/clim/36/8/JCLI-D-22-0292.1.pdf
0,AMS,clim,Volume 36,Issue 8,Sensitivity of the Southern Hemisphere Wintertime Teleconnection to the Location of ENSO Heating,https://journals.ametsoc.org/downloadpdf/view/journals/clim/36/8/JCLI-D-22-0159.1.pdf
0,AMS,clim,Volume 36,Issue 8,The Dynamical Tropopause Location as a Potential Predictor for North Atlantic Tropical Cyclone Activity,https://journals.ametsoc.org/downloadpdf/view/journals/clim/36/8/JCLI-D-22-0479.1.pdf
0,AMS,clim,Volume 36,Issue 8,Sources of Uncertainty in the Time of Emergence of Tropical Pacific Climate Change Signal: Role of Internal Variability,https://journals.ametsoc.org/downloadpdf/view/journals/clim/36/8/JCLI-D-22-0554.1.pdf
0,AMS,clim,Volume 36,Issue 8,The Deep Arctic Ocean and Fram Strait in CMIP6 Models,https://journals.ametsoc.org/downloadpdf/view/journals/clim/36/8/JCLI-D-22-0194.1.pdf
0,AMS,clim,Volume 36,Issue 8,A Novel Mechanism for Extreme El Niño Events: Interactions between Tropical Cyclones in the Western North Pacific and Sea Surface Warming in the Eastern Tropical Pacific,https://journals.ametsoc.org/downloadpdf/view/journals/clim/36/8/JCLI-D-21-1014.1.pdf
0,AMS,clim,Volume 36,Issue 8,Southern Hemisphere Response to the Quasi-Biennial Oscillation in the CMIP5/6 Models,https://journals.ametsoc.org/downloadpdf/view/journals/clim/36/8/JCLI-D-22-0675.1.pdf
0,AMS,clim,Volume 36,Issue 8,Upper-Ocean Circulation and Tropical Atlantic Interannual Modes,https://journals.ametsoc.org/downloadpdf/view/journals/clim/36/8/JCLI-D-22-0184.1.pdf
0,AMS,clim,Volume 36,Issue 8,Asymmetric Boreal Summer Intraseasonal Oscillation Events over the Western North Pacific and Their Impacts on East Asian Precipitation,https://journals.ametsoc.org/downloadpdf/view/journals/clim/36/8/JCLI-D-22-0750.1.pdf
0,AMS,clim,Volume 36,Issue 8,Rectified Ocean Heat Uptake from Oscillatory Surface Forcing,https://journals.ametsoc.org/downloadpdf/view/journals/clim/36/8/JCLI-D-22-0267.1.pdf
0,AMS,clim,Volume 36,Issue 8,Quantifying the Predictability of ENSO Complexity Using a Statistically Accurate Multiscale Stochastic Model and Information Theory,https://journals.ametsoc.org/downloadpdf/view/journals/clim/36/8/JCLI-D-22-0151.1.pdf
0,AMS,clim,Volume 36,Issue 8,Projected Impacts of Antarctic Meltwater Anomalies over the Twenty-First Century,https://journals.ametsoc.org/downloadpdf/view/journals/clim/36/8/JCLI-D-22-0457.1.pdf
0,AMS,clim,Volume 36,Issue 8,Upper-Oceanic Warming in the Gulf of Mexico between 1950 and 2020,https://journals.ametsoc.org/downloadpdf/view/journals/clim/36/8/JCLI-D-22-0409.1.pdf
0,AMS,clim,Volume 36,Issue 8,Past to Future Drylands in China: A Multimodel Analysis Using CMIP6 Simulations,https://journals.ametsoc.org/downloadpdf/view/journals/clim/36/8/JCLI-D-22-0720.1.pdf
0,AMS,clim,Volume 36,Issue 8,The Key Role of Cloud–Climate Coupling in Extratropical Sea Surface Temperature Variability,https://journals.ametsoc.org/downloadpdf/view/journals/clim/36/8/JCLI-D-22-0362.1.pdf
0,AMS,clim,Volume 36,Issue 9,Moist Thermodynamics of Convectively Coupled Waves over the Western Hemisphere,https://journals.ametsoc.org/downloadpdf/view/journals/clim/36/9/JCLI-D-22-0435.1.pdf
0,AMS,clim,Volume 36,Issue 9,Estimating the Significance of the Added Skill from Initializations: The Case of Decadal Predictions,https://journals.ametsoc.org/downloadpdf/view/journals/clim/36/9/JCLI-D-22-0605.1.pdf
0,AMS,clim,Volume 36,Issue 9,A Joint Approach Combining Correlation and Mutual Information to Study Land and Ocean Drivers of U.S. Droughts: Methodology,https://journals.ametsoc.org/downloadpdf/view/journals/clim/36/9/JCLI-D-22-0429.1.pdf
0,AMS,clim,Volume 36,Issue 9,Interannual Variability of the Wintertime Asian–Bering–North American Teleconnection Linked to Eurasian Snow Cover and Maritime Continent Sea Surface Temperature,https://journals.ametsoc.org/downloadpdf/view/journals/clim/36/9/JCLI-D-22-0367.1.pdf
0,AMS,clim,Volume 36,Issue 9,Zonally Asymmetric Multidecadal Variability of the North Pacific Subtropical Fronts,https://journals.ametsoc.org/downloadpdf/view/journals/clim/36/9/JCLI-D-22-0299.1.pdf
0,AMS,clim,Volume 36,Issue 9,Reanalyzing the Relationship of Tropical Cyclone Frequency and Intensity Affecting South Korea with the Pacific Decadal Oscillation,https://journals.ametsoc.org/downloadpdf/view/journals/clim/36/9/JCLI-D-22-0302.1.pdf
0,AMS,clim,Volume 36,Issue 9,A Physical Explanation for Ocean Air–Water Warming Differences under CO2-Forced Warming,https://journals.ametsoc.org/downloadpdf/view/journals/clim/36/9/JCLI-D-22-0215.1.pdf
0,AMS,clim,Volume 36,Issue 9,Regional Persistent Extreme Precipitation Events over Southwest China under Different Low-Latitude Intraseasonal Oscillations during the Rainy Season,https://journals.ametsoc.org/downloadpdf/view/journals/clim/36/9/JCLI-D-22-0310.1.pdf
0,AMS,clim,Volume 36,Issue 9,Three-Dimensional Structure of Convectively Coupled Equatorial Waves in Aquaplanet Experiments with Resolved or Parameterized Convection,https://journals.ametsoc.org/downloadpdf/view/journals/clim/36/9/JCLI-D-22-0422.1.pdf
0,AMS,clim,Volume 36,Issue 9,Modulation Effect of the Annual Cycle on Interdecadal Warming Trends over the Tibetan Plateau during 1998–2020,https://journals.ametsoc.org/downloadpdf/view/journals/clim/36/9/JCLI-D-22-0517.1.pdf
0,AMS,clim,Volume 36,Issue 10,Influence of Stationary Waves on Precipitation Change in North American Summer during the Last Glacial Maximum,https://journals.ametsoc.org/downloadpdf/view/journals/clim/36/10/JCLI-D-21-0886.1.pdf
0,AMS,clim,Volume 36,Issue 10,Climate Impacts of Convective Cloud Microphysics in NCAR CAM5,https://journals.ametsoc.org/downloadpdf/view/journals/clim/36/10/JCLI-D-22-0136.1.pdf
0,AMS,clim,Volume 36,Issue 10,North Atlantic Oscillation–Associated Variation in Cloud Phase and Cloud Radiative Forcing over the Greenland Ice Sheet,https://journals.ametsoc.org/downloadpdf/view/journals/clim/36/10/JCLI-D-22-0718.1.pdf
0,AMS,clim,Volume 36,Issue 10,Linkage of the Circumglobal Teleconnection and the Interannual Variability of Early Spring Diabatic Heating over Low-Latitude Highlands in Southeast Asia,https://journals.ametsoc.org/downloadpdf/view/journals/clim/36/10/JCLI-D-22-0659.1.pdf
0,AMS,clim,Volume 36,Issue 10,Impacts of Anthropogenic Emissions over South Asia on East Asian Spring Climate: Two Possible Dynamical Pathways,https://journals.ametsoc.org/downloadpdf/view/journals/clim/36/10/JCLI-D-22-0049.1.pdf
0,AMS,clim,Volume 36,Issue 10,Bias and Uncertainty of the Relationship between AO and Winter Synoptic Temperature Variability over the Northern Hemisphere under Present and Future Climate,https://journals.ametsoc.org/downloadpdf/view/journals/clim/36/10/JCLI-D-22-0230.1.pdf
0,AMS,clim,Volume 36,Issue 10,Contribution of PDO to Decadal Variations of Glaze Dipole Pattern in China,https://journals.ametsoc.org/downloadpdf/view/journals/clim/36/10/JCLI-D-21-0932.1.pdf
0,AMS,clim,Volume 36,Issue 10,Interdecadal Variations of the Scandinavian Pattern,https://journals.ametsoc.org/downloadpdf/view/journals/clim/36/10/JCLI-D-22-0494.1.pdf
0,AMS,clim,Volume 36,Issue 10,Upstream Large-Scale Control of Subtropical Low-Cloud Climatology,https://journals.ametsoc.org/downloadpdf/view/journals/clim/36/10/JCLI-D-22-0676.1.pdf
0,AMS,clim,Volume 36,Issue 10,Stratospheric Ozone Changes Damp the CO2-Induced Acceleration of the Brewer–Dobson Circulation,https://journals.ametsoc.org/downloadpdf/view/journals/clim/36/10/JCLI-D-22-0512.1.pdf
0,AMS,clim,Volume 36,Issue 10,Pitfalls of Climate Network Construction—A Statistical Perspective,https://journals.ametsoc.org/downloadpdf/view/journals/clim/36/10/JCLI-D-22-0549.1.pdf
0,AMS,clim,Volume 36,Issue 10,Understanding the Variation and Mechanisms of Tropical Cyclone Genesis Potential over the Western North Pacific during the Past 20 000 Years,https://journals.ametsoc.org/downloadpdf/view/journals/clim/36/10/JCLI-D-22-0638.1.pdf
0,AMS,clim,Volume 36,Issue 10,Characteristics of Surface “Melt Potential” over Antarctic Ice Shelves based on Regional Atmospheric Model Simulations of Summer Air Temperature Extremes from 1979/80 to 2018/19,https://journals.ametsoc.org/downloadpdf/view/journals/clim/36/10/JCLI-D-22-0386.1.pdf
0,AMS,clim,Volume 36,Issue 10,Characteristics and Formation of Two Leading Marine Heatwave Modes in the North Indian Ocean during Summer and Their Implications for Local Precipitation,https://journals.ametsoc.org/downloadpdf/view/journals/clim/36/10/JCLI-D-22-0574.1.pdf
0,AMS,clim,Volume 36,Issue 10,Ambiguous Variations in Tropical Latent Heat Flux since the Years around 1998,https://journals.ametsoc.org/downloadpdf/view/journals/clim/36/10/JCLI-D-22-0381.1.pdf
0,AMS,clim,Volume 36,Issue 10,Northward Shifts of the Sahara Desert in Response to Twenty-First-Century Climate Change,https://journals.ametsoc.org/downloadpdf/view/journals/clim/36/10/JCLI-D-22-0169.1.pdf
0,AMS,clim,Volume 36,Issue 10,Tibetan Plateau Booster Effect on the Influence of Atlantic Multidecadal Variability on the East Asian Summer Rainfall,https://journals.ametsoc.org/downloadpdf/view/journals/clim/36/10/JCLI-D-22-0472.1.pdf
0,AMS,clim,Volume 36,Issue 10,Optimal Precursors for Central Pacific El Niño Events in GFDL CM2p1,https://journals.ametsoc.org/downloadpdf/view/journals/clim/36/10/JCLI-D-22-0328.1.pdf
0,AMS,clim,Volume 36,Issue 10,The Edge Intensification of Eastern Pacific ITCZ Convection,https://journals.ametsoc.org/downloadpdf/view/journals/clim/36/10/JCLI-D-22-0382.1.pdf
0,AMS,clim,Volume 36,Issue 10,Spatiotemporal Variability of Tropical Cyclone–Induced Ocean Heat Uptake and Its Effect on Ocean Heat Content,https://journals.ametsoc.org/downloadpdf/view/journals/clim/36/10/JCLI-D-22-0595.1.pdf
0,AMS,clim,Volume 36,Issue 10,Energetic Constraints on the Pattern of Changes to the Hydrological Cycle under Global Warming,https://journals.ametsoc.org/downloadpdf/view/journals/clim/36/10/JCLI-D-22-0337.1.pdf
0,AMS,clim,Volume 36,Issue 10,How the 1999 Climate Shift Has Changed MJO Propagation Diversity,https://journals.ametsoc.org/downloadpdf/view/journals/clim/36/10/JCLI-D-22-0749.1.pdf
0,AMS,clim,Volume 36,Issue 11,The Time Scales of Climate Responses to Carbon Dioxide and Aerosols,https://journals.ametsoc.org/downloadpdf/view/journals/clim/36/11/JCLI-D-22-0513.1.pdf
0,AMS,clim,Volume 36,Issue 11,The Impacts of Combined SAM and ENSO on Seasonal Antarctic Sea Ice Changes,https://journals.ametsoc.org/downloadpdf/view/journals/clim/36/11/JCLI-D-22-0679.1.pdf
0,AMS,clim,Volume 36,Issue 11,Global Climate Impacts of Greenland and Antarctic Meltwater: A Comparative Study,https://journals.ametsoc.org/downloadpdf/view/journals/clim/36/11/JCLI-D-22-0433.1.pdf
0,AMS,clim,Volume 36,Issue 11,Extreme Surface Energy Budget Anomalies in the High Arctic in Winter,https://journals.ametsoc.org/downloadpdf/view/journals/clim/36/11/JCLI-D-22-0209.1.pdf
0,AMS,clim,Volume 36,Issue 11,Relative Contribution of Moisture Transport during TC-Active and TC-Inactive Periods to the Precipitation in Henan Province of North China: Mean State and an Extreme Event,https://journals.ametsoc.org/downloadpdf/view/journals/clim/36/11/JCLI-D-22-0582.1.pdf
0,AMS,clim,Volume 36,Issue 11,Possible Mechanisms of Interannual Variations in Surface Mixed Layer Temperatures off Somalia in Boreal Summer,https://journals.ametsoc.org/downloadpdf/view/journals/clim/36/11/JCLI-D-22-0082.1.pdf
0,AMS,clim,Volume 36,Issue 11,Synoptic-Scale Effects of Atmospheric Heat Source over Key Areas of the Tibetan Plateau on Its Downstream Rainfall in Summer,https://journals.ametsoc.org/downloadpdf/view/journals/clim/36/11/JCLI-D-22-0563.1.pdf
0,AMS,clim,Volume 36,Issue 11,Homogenization of Observed Surface Wind Speed Based on Geostrophic Wind Theory over China from 1970 to 2017,https://journals.ametsoc.org/downloadpdf/view/journals/clim/36/11/JCLI-D-22-0445.1.pdf
0,AMS,clim,Volume 36,Issue 11,Role of the Aleutian Low in Modulating the Connection between the Moderate El Niño and the Following Spring North Tropical Atlantic SST Anomalies,https://journals.ametsoc.org/downloadpdf/view/journals/clim/36/11/JCLI-D-22-0656.1.pdf
0,AMS,clim,Volume 36,Issue 11,A Trans-Season Out-of-Phase Relationship of Tropical Cyclogenesis between the Western North Pacific and South China Sea,https://journals.ametsoc.org/downloadpdf/view/journals/clim/36/11/JCLI-D-22-0753.1.pdf
0,AMS,clim,Volume 36,Issue 11,Destinations and Pathways of the Indonesian Throughflow Water in the Indian Ocean,https://journals.ametsoc.org/downloadpdf/view/journals/clim/36/11/JCLI-D-22-0631.1.pdf
0,AMS,clim,Volume 36,Issue 11,Prediction of Summer Precipitation in North China: Role of the Evolution of Sea Surface Temperature Anomalies from Boreal Winter to Spring,https://journals.ametsoc.org/downloadpdf/view/journals/clim/36/11/JCLI-D-22-0559.1.pdf
0,AMS,clim,Volume 36,Issue 11,Causal Forcing Analysis on the Low-Frequency Variations of Eddy Kinetic Energy in the Kuroshio Extension Region,https://journals.ametsoc.org/downloadpdf/view/journals/clim/36/11/JCLI-D-22-0702.1.pdf
0,AMS,clim,Volume 36,Issue 11,Interdecadal Changes in the Dominant Modes of Spring Snow Cover over the Tibetan Plateau around the Early 1990s,https://journals.ametsoc.org/downloadpdf/view/journals/clim/36/11/JCLI-D-22-0487.1.pdf
0,AMS,clim,Volume 36,Issue 11,Can Tibetan Plateau Snow Depth Influence the Interannual Association between Tropical Indian Ocean Sea Surface Temperatures and Rapidly Intensifying Typhoons?,https://journals.ametsoc.org/downloadpdf/view/journals/clim/36/11/JCLI-D-22-0697.1.pdf
0,AMS,clim,Volume 36,Issue 11,Variations in Summer Extreme Hot–Humid Events over Eastern China and the Possible Associated Mechanisms,https://journals.ametsoc.org/downloadpdf/view/journals/clim/36/11/JCLI-D-22-0695.1.pdf
0,AMS,clim,Volume 36,Issue 11,Role of the Low-Latitude Quasi-Biweekly Oscillation in the Extreme Persistent Heavy Rainfall in the Mei-Yu Season over the Middle and Lower Reaches of the Yangtze River,https://journals.ametsoc.org/downloadpdf/view/journals/clim/36/11/JCLI-D-22-0343.1.pdf
0,AMS,clim,Volume 36,Issue 11,Subtropical Impact on the Tropical Double-ITCZ Bias in the GFDL CM2.1 Model,https://journals.ametsoc.org/downloadpdf/view/journals/clim/36/11/JCLI-D-22-0432.1.pdf
0,AMS,clim,Volume 36,Issue 11,Southern Ocean Surface Temperatures and Cloud Biases in Climate Models Connected to the Representation of Glacial Deep Ocean Circulation,https://journals.ametsoc.org/downloadpdf/view/journals/clim/36/11/JCLI-D-22-0221.1.pdf
0,AMS,clim,Volume 36,Issue 11,Land–Atmosphere Interactions Partially Offset the Accelerated Tibetan Plateau Water Cycle through Dynamical Processes,https://journals.ametsoc.org/downloadpdf/view/journals/clim/36/11/JCLI-D-22-0686.1.pdf
0,AMS,clim,Volume 36,Issue 12,Environmental Control of Wind Response to Sea Surface Temperature Patterns in Reanalysis Dataset,https://journals.ametsoc.org/downloadpdf/view/journals/clim/36/12/JCLI-D-22-0373.1.pdf
0,AMS,clim,Volume 36,Issue 12,Mean State AMOC Affects AMOC Weakening through Subsurface Warming in the Labrador Sea,https://journals.ametsoc.org/downloadpdf/view/journals/clim/36/12/JCLI-D-22-0464.1.pdf
0,AMS,clim,Volume 36,Issue 12,Distinct Impacts of Two Types of Summer ENSO with Different Temporal Evolutions on the Asian Summer Monsoon: Role of the Tropical Indo-Western Pacific,https://journals.ametsoc.org/downloadpdf/view/journals/clim/36/12/JCLI-D-22-0532.1.pdf
0,AMS,clim,Volume 36,Issue 12,Intermodel Spread of Historical Indian Monsoon Rainfall Change in CMIP6: The Role of the Tropical Pacific Mean State,https://journals.ametsoc.org/downloadpdf/view/journals/clim/36/12/JCLI-D-22-0585.1.pdf
0,AMS,clim,Volume 36,Issue 12,Spatiotemporal Variabilities of the Recent Indian Summer Monsoon Activities in the Tibetan Plateau: A Reanalysis of Outgoing Longwave Radiation Datasets,https://journals.ametsoc.org/downloadpdf/view/journals/clim/36/12/JCLI-D-22-0518.1.pdf
0,AMS,clim,Volume 36,Issue 12,Boreal Summer Extratropical Intraseasonal Waves over the Eurasian Continent and Real-Time Monitoring Metrics,https://journals.ametsoc.org/downloadpdf/view/journals/clim/36/12/JCLI-D-22-0788.1.pdf
0,AMS,clim,Volume 36,Issue 12,Relationship between the East Asian Summer and Winter Monsoons at Obliquity Time Scales,https://journals.ametsoc.org/downloadpdf/view/journals/clim/36/12/JCLI-D-22-0587.1.pdf
0,AMS,clim,Volume 36,Issue 12,Impact of Evaporation in Yangtze River Valley on Heat Stress in North China,https://journals.ametsoc.org/downloadpdf/view/journals/clim/36/12/JCLI-D-22-0573.1.pdf
0,AMS,clim,Volume 36,Issue 12,Implied Heat Transport from CERES Data: Direct Radiative Effect of Clouds on Regional Patterns and Hemispheric Symmetry,https://journals.ametsoc.org/downloadpdf/view/journals/clim/36/12/JCLI-D-22-0149.1.pdf
0,AMS,clim,Volume 36,Issue 12,Prediction of Intermonth Modes of Winter Air Temperature over China,https://journals.ametsoc.org/downloadpdf/view/journals/clim/36/12/JCLI-D-22-0685.1.pdf
0,AMS,clim,Volume 36,Issue 12,Delayed Response of the Onset of the Summer Monsoon over the Bay of Bengal to Land–Sea Thermal Contrast,https://journals.ametsoc.org/downloadpdf/view/journals/clim/36/12/JCLI-D-22-0478.1.pdf
0,AMS,clim,Volume 36,Issue 12,Response of the Madden–Julian Oscillation and Tropical Atmosphere to Changes in Oceanic Mixed Layer Depth over the Indian Ocean,https://journals.ametsoc.org/downloadpdf/view/journals/clim/36/12/JCLI-D-21-0788.1.pdf
0,AMS,clim,Volume 36,Issue 12,Barotropic and Nonlinear Decay of the Wintertime Baroclinic Wave Packets over the North Pacific: Energetics Analysis,https://journals.ametsoc.org/downloadpdf/view/journals/clim/36/12/JCLI-D-22-0667.1.pdf
0,AMS,clim,Volume 36,Issue 12,Connections between Upper Tropospheric and Lower Stratospheric Circulation Responses to Increased CO2,https://journals.ametsoc.org/downloadpdf/view/journals/clim/36/12/JCLI-D-22-0851.1.pdf
0,AMS,clim,Volume 36,Issue 12,Pacific Meridional Mode Does Not Induce Strong Positive SST Anomalies in the Central Equatorial Pacific,https://journals.ametsoc.org/downloadpdf/view/journals/clim/36/12/JCLI-D-22-0503.1.pdf
0,AMS,clim,Volume 36,Issue 12,"Long-Term Changes, Synoptic Behaviors, and Future Projections of Large-Scale Anomalous Precipitation Events in China Detected by a Deep Learning Autoencoder",https://journals.ametsoc.org/downloadpdf/view/journals/clim/36/12/JCLI-D-22-0737.1.pdf
0,AMS,clim,Volume 36,Issue 12,"Forcing, Cloud Feedbacks, Cloud Masking, and Internal Variability in the Cloud Radiative Effect Satellite Record",https://journals.ametsoc.org/downloadpdf/view/journals/clim/36/12/JCLI-D-22-0555.1.pdf
0,AMS,clim,Volume 36,Issue 12,Tropical Indian Ocean Mixed Layer Bias in CMIP6 CGCMs Primarily Attributed to the AGCM Surface Wind Bias,https://journals.ametsoc.org/downloadpdf/view/journals/clim/36/12/JCLI-D-22-0546.1.pdf
0,AMS,clim,Volume 36,Issue 12,Interdecadal Variability of the Meridional Wind across the Eastern Equatorial Pacific and Its Relationship with ENSO,https://journals.ametsoc.org/downloadpdf/view/journals/clim/36/12/JCLI-D-22-0516.1.pdf
0,AMS,clim,Volume 36,Issue 12,Tracing Time-Varying Characteristics of Meteorological Drought through Nonstationary Joint Deficit Index,https://journals.ametsoc.org/downloadpdf/view/journals/clim/36/12/JCLI-D-22-0437.1.pdf
0,AMS,clim,Volume 36,Issue 12,Modulations of Storm-Track Activity Associated with the Baroclinic Annular Mode,https://journals.ametsoc.org/downloadpdf/view/journals/clim/36/12/JCLI-D-22-0377.1.pdf
0,AMS,clim,Volume 36,Issue 12,Modulation of Mid–High-Latitude Intraseasonal Variability on the Occurrence Frequency of Northeast China Cold Vortex in Early Summer,https://journals.ametsoc.org/downloadpdf/view/journals/clim/36/12/JCLI-D-22-0691.1.pdf
0,AMS,clim,Volume 36,Issue 12,Evaluation and Process-Oriented Diagnosis of the GEFSv12 Reforecasts,https://journals.ametsoc.org/downloadpdf/view/journals/clim/36/12/JCLI-D-22-0772.1.pdf
0,AMS,clim,Volume 36,Issue 12,Weakening of the Silk Road Pattern in August after the Mid-1990s,https://journals.ametsoc.org/downloadpdf/view/journals/clim/36/12/JCLI-D-22-0762.1.pdf
0,AMS,clim,Volume 36,Issue 13,Climatology of Low-Level Clouds over Western Equatorial Africa Based on Ground Observations and Satellites,https://journals.ametsoc.org/downloadpdf/view/journals/clim/36/13/JCLI-D-22-0364.1.pdf
0,AMS,clim,Volume 36,Issue 13,An Energy Budget Framework to Understand Mechanisms of Land–Ocean Warming Contrast Induced by Increasing Greenhouse Gases. Part II: Transient Climate State,https://journals.ametsoc.org/downloadpdf/view/journals/clim/36/13/JCLI-D-22-0483.1.pdf
0,AMS,clim,Volume 36,Issue 13,Role of Ocean Advections during the Evolution of the Pacific Meridional Modes,https://journals.ametsoc.org/downloadpdf/view/journals/clim/36/13/JCLI-D-22-0296.1.pdf
0,AMS,clim,Volume 36,Issue 13,Impact of North Indian Atmospheric Diabatic Heating on Summer Precipitation in Central Asia,https://journals.ametsoc.org/downloadpdf/view/journals/clim/36/13/JCLI-D-22-0928.1.pdf
0,AMS,clim,Volume 36,Issue 13,Weakened Subtropical Westerlies Reduced Early Spring Precipitation in the Southeast Tibetan Plateau,https://journals.ametsoc.org/downloadpdf/view/journals/clim/36/13/JCLI-D-22-0770.1.pdf
0,AMS,clim,Volume 36,Issue 13,"Alaska Terrestrial and Marine Climate Trends, 1957–2021",https://journals.ametsoc.org/downloadpdf/view/journals/clim/36/13/JCLI-D-22-0434.1.pdf
